{
  "schema_version": "CANDIDATE_COMPATIBILITY_GRAPH_V1",
  "nodes": [
    {
      "node_id": "ANTIBIOTICS_AND_PLEURAL_DRAINAGE",
      "label": "Antibiotics with pleural drainage",
      "kind": "KEY_OR_CANDIDATE"
    },
    {
      "node_id": "ASK_PATIENT_PREFERENCES_AND_SUPPORT_SELF_DETERMINATION",
      "label": "Ask the patient's preferences and support self-determination",
      "kind": "KEY_OR_CANDIDATE"
    },
    {
      "node_id": "ASSESS_REVERSIBLE_CAUSES_AND_INITIATE_NONPHARMACOLOGIC_CARE",
      "label": "Assess reversible causes and initiate non-pharmacologic delirium care",
      "kind": "KEY_OR_CANDIDATE"
    },
    {
      "node_id": "BORDERLINE_PERSONALITY_DISORDER",
      "label": "Borderline personality disorder",
      "kind": "KEY_OR_CANDIDATE"
    },
    {
      "node_id": "BULIMIA_NERVOSA",
      "label": "Bulimia nervosa",
      "kind": "KEY_OR_CANDIDATE"
    },
    {
      "node_id": "CELL_FREE_DNA_SCREENING",
      "label": "Cell-free DNA screening",
      "kind": "KEY_OR_CANDIDATE"
    },
    {
      "node_id": "CLARIFY_GOALS_VALUES_AND_SUBSTITUTE_DECISION_MAKER",
      "label": "Clarify goals and values with the patient or appropriate substitute decision-maker",
      "kind": "KEY_OR_CANDIDATE"
    },
    {
      "node_id": "CONCEPT-R4-SU-PS-14-BD2",
      "label": "Bipolar II disorder",
      "kind": "KEY_OR_CANDIDATE"
    },
    {
      "node_id": "ENSURE_SAFETY_AND_ARRANGE_SPECIALIZED_ASSESSMENT",
      "label": "Ensure immediate safety and arrange specialized assessment",
      "kind": "KEY_OR_CANDIDATE"
    },
    {
      "node_id": "HERPES_ZOSTER",
      "label": "Herpes zoster",
      "kind": "KEY_OR_CANDIDATE"
    },
    {
      "node_id": "HYPEREMESIS_GRAVIDARUM",
      "label": "Hyperemesis gravidarum",
      "kind": "KEY_OR_CANDIDATE"
    },
    {
      "node_id": "INADEQUATE_CALORIC_INTAKE",
      "label": "Inadequate caloric intake",
      "kind": "KEY_OR_CANDIDATE"
    },
    {
      "node_id": "MAINTAIN_CONFIDENTIALITY",
      "label": "Maintain confidentiality",
      "kind": "KEY_OR_CANDIDATE"
    },
    {
      "node_id": "MALIGNANT_MELANOMA",
      "label": "Malignant melanoma",
      "kind": "KEY_OR_CANDIDATE"
    },
    {
      "node_id": "MODEL-CONCEPT-03841BEAE22D1EB1",
      "label": "Pediatric feeding disorder",
      "kind": "KEY_OR_CANDIDATE"
    },
    {
      "node_id": "MODEL-CONCEPT-08D43E2CAC39AB30",
      "label": "Nummular dermatitis",
      "kind": "KEY_OR_CANDIDATE"
    },
    {
      "node_id": "MODEL-CONCEPT-1C86368E5FB9786C",
      "label": "Therapeutic thoracentesis without catheter drainage",
      "kind": "KEY_OR_CANDIDATE"
    },
    {
      "node_id": "MODEL-CONCEPT-1E7D7C5057C13F6E",
      "label": "Serial abdominal examinations",
      "kind": "KEY_OR_CANDIDATE"
    },
    {
      "node_id": "MODEL-CONCEPT-1ECB2000F0F8C997",
      "label": "Provide reorientation, mobilization, and sleep support",
      "kind": "KEY_OR_CANDIDATE"
    },
    {
      "node_id": "MODEL-CONCEPT-2C5A81BB27FE730B",
      "label": "Dermatitis herpetiformis",
      "kind": "KEY_OR_CANDIDATE"
    },
    {
      "node_id": "MODEL-CONCEPT-2EF35B5157293CEB",
      "label": "Vortioxetine",
      "kind": "KEY_OR_CANDIDATE"
    },
    {
      "node_id": "MODEL-CONCEPT-3D299EBFACD6439C",
      "label": "Offer a structured family meeting with the authorized decision-maker",
      "kind": "KEY_OR_CANDIDATE"
    },
    {
      "node_id": "MODEL-CONCEPT-4305264A54322694",
      "label": "Plain abdominal radiography",
      "kind": "KEY_OR_CANDIDATE"
    },
    {
      "node_id": "MODEL-CONCEPT-4409A3B3919B95E7",
      "label": "Blue nevus",
      "kind": "KEY_OR_CANDIDATE"
    },
    {
      "node_id": "MODEL-CONCEPT-52411E9A4249C927",
      "label": "Disclose the record to police whenever requested",
      "kind": "KEY_OR_CANDIDATE"
    },
    {
      "node_id": "MODEL-CONCEPT-5341B8F038F2BB9D",
      "label": "Detailed fetal anatomy ultrasound",
      "kind": "KEY_OR_CANDIDATE"
    },
    {
      "node_id": "MODEL-CONCEPT-5AB90F8FCF94CA08",
      "label": "Observation without antimicrobial therapy",
      "kind": "KEY_OR_CANDIDATE"
    },
    {
      "node_id": "MODEL-CONCEPT-6FC889ED23257E2F",
      "label": "Monoamine oxidase inhibitor",
      "kind": "KEY_OR_CANDIDATE"
    },
    {
      "node_id": "MODEL-CONCEPT-7524C824367EB2FA",
      "label": "Acute appendicitis",
      "kind": "KEY_OR_CANDIDATE"
    },
    {
      "node_id": "MODEL-CONCEPT-78F946A31B3A4118",
      "label": "Apply physical restraints for agitation",
      "kind": "KEY_OR_CANDIDATE"
    },
    {
      "node_id": "MODEL-CONCEPT-7F1ED325F9604B9D",
      "label": "Offer access to culturally safe trauma-informed care",
      "kind": "KEY_OR_CANDIDATE"
    },
    {
      "node_id": "MODEL-CONCEPT-87125C6BF1A03CE7",
      "label": "Bleeding from a cervical lesion",
      "kind": "KEY_OR_CANDIDATE"
    },
    {
      "node_id": "MODEL-CONCEPT-9E0C263DEC9EB71F",
      "label": "Diabetic ketoacidosis",
      "kind": "KEY_OR_CANDIDATE"
    },
    {
      "node_id": "MODEL-CONCEPT-A480A5EA2DE323CB",
      "label": "Rumination disorder",
      "kind": "KEY_OR_CANDIDATE"
    },
    {
      "node_id": "MODEL-CONCEPT-A51FCFB18091FC71",
      "label": "Nuchal translucency ultrasound",
      "kind": "KEY_OR_CANDIDATE"
    },
    {
      "node_id": "MODEL-CONCEPT-AD607B58BC650EF4",
      "label": "Food insecurity",
      "kind": "KEY_OR_CANDIDATE"
    },
    {
      "node_id": "MODEL-CONCEPT-AF8B5975CC5ACC66",
      "label": "Bedbug bites",
      "kind": "KEY_OR_CANDIDATE"
    },
    {
      "node_id": "MODEL-CONCEPT-B8753B7B779FDCE6",
      "label": "Cow's milk protein allergy",
      "kind": "KEY_OR_CANDIDATE"
    },
    {
      "node_id": "MODEL-CONCEPT-BDCC6B2CB5A994BB",
      "label": "Solar lentigo",
      "kind": "KEY_OR_CANDIDATE"
    },
    {
      "node_id": "MODEL-CONCEPT-C2AEBE751E808DD4",
      "label": "Use de-identified consultation for clinical advice",
      "kind": "KEY_OR_CANDIDATE"
    },
    {
      "node_id": "MODEL-CONCEPT-C922DCB8398A4F22",
      "label": "Anal fissure with stool withholding",
      "kind": "KEY_OR_CANDIDATE"
    },
    {
      "node_id": "MODEL-CONCEPT-CC0B0647FC4298B9",
      "label": "Anorexia nervosa, restricting type",
      "kind": "KEY_OR_CANDIDATE"
    },
    {
      "node_id": "MODEL-CONCEPT-D18D37E72A10B4B0",
      "label": "Interview the caregiver before speaking with the child",
      "kind": "KEY_OR_CANDIDATE"
    },
    {
      "node_id": "MODEL-CONCEPT-DB5BD3605CC865D2",
      "label": "Threatened preterm labour",
      "kind": "KEY_OR_CANDIDATE"
    },
    {
      "node_id": "MODEL-CONCEPT-DDEE2F54A62965CD",
      "label": "Dependent personality disorder",
      "kind": "KEY_OR_CANDIDATE"
    },
    {
      "node_id": "MODEL-CONCEPT-DF0F2244EE22CB09",
      "label": "Phytophotodermatitis",
      "kind": "KEY_OR_CANDIDATE"
    },
    {
      "node_id": "MODEL-CONCEPT-DF6E4D94F8BE76DB",
      "label": "Ask whether traditional healing supports are desired",
      "kind": "KEY_OR_CANDIDATE"
    },
    {
      "node_id": "MODEL-CONCEPT-E3E69D6538AE5559",
      "label": "Complex post-traumatic stress disorder",
      "kind": "KEY_OR_CANDIDATE"
    },
    {
      "node_id": "MODEL-CONCEPT-E83A458467EE5AE0",
      "label": "Consult a child-abuse pediatric specialist",
      "kind": "KEY_OR_CANDIDATE"
    },
    {
      "node_id": "MODEL-CONCEPT-FB47F7A97A691C10",
      "label": "Request a palliative-care consultation",
      "kind": "KEY_OR_CANDIDATE"
    },
    {
      "node_id": "PLACENTAL_ABRUPTION",
      "label": "Placental abruption",
      "kind": "KEY_OR_CANDIDATE"
    },
    {
      "node_id": "REFV3-00D24C10450443A7",
      "label": "Spinal cord disorder causing neurogenic bowel",
      "kind": "KEY_OR_CANDIDATE"
    },
    {
      "node_id": "REFV3-04EDA15BCED9E328",
      "label": "Disclose the minimum necessary information to prevent imminent serious harm",
      "kind": "KEY_OR_CANDIDATE"
    },
    {
      "node_id": "REFV3-1279945D30512F42",
      "label": "Labour-related cervical bleeding",
      "kind": "KEY_OR_CANDIDATE"
    },
    {
      "node_id": "REFV3-18CDACA75458DC4F",
      "label": "Anorexia nervosa, binge-eating/purging type",
      "kind": "KEY_OR_CANDIDATE"
    },
    {
      "node_id": "REFV3-1F47A4C603971B85",
      "label": "Automatically involve an Elder because the patient is Indigenous",
      "kind": "KEY_OR_CANDIDATE"
    },
    {
      "node_id": "REFV3-225CCA998AB50674",
      "label": "Invite a chosen family member or Elder",
      "kind": "KEY_OR_CANDIDATE"
    },
    {
      "node_id": "REFV3-251ED51EA3429731",
      "label": "Dermatofibroma",
      "kind": "KEY_OR_CANDIDATE"
    },
    {
      "node_id": "REFV3-2E9BF6180E8B0E65",
      "label": "Bupropion",
      "kind": "KEY_OR_CANDIDATE"
    },
    {
      "node_id": "REFV3-314347E3CDB4F53E",
      "label": "Chest-tube drainage with intrapleural therapy",
      "kind": "KEY_OR_CANDIDATE"
    },
    {
      "node_id": "REFV3-33FE1A36933FD456",
      "label": "Papular urticaria from arthropod bites",
      "kind": "KEY_OR_CANDIDATE"
    },
    {
      "node_id": "REFV3-367D39CB61457D0F",
      "label": "Offer a time-limited trial of treatment with agreed stopping criteria",
      "kind": "KEY_OR_CANDIDATE"
    },
    {
      "node_id": "REFV3-3ABEBA0419041836",
      "label": "Arrange urgent emergency stabilization",
      "kind": "KEY_OR_CANDIDATE"
    },
    {
      "node_id": "REFV3-3F37F9F7E17EEDCA",
      "label": "Histrionic personality disorder",
      "kind": "KEY_OR_CANDIDATE"
    },
    {
      "node_id": "REFV3-40CB8D452BD49454",
      "label": "Use a low-dose antipsychotic for dangerous agitation",
      "kind": "KEY_OR_CANDIDATE"
    },
    {
      "node_id": "REFV3-4236B830DE9F9BA2",
      "label": "Mirtazapine",
      "kind": "KEY_OR_CANDIDATE"
    },
    {
      "node_id": "REFV3-42D692821AE9A185",
      "label": "Purging disorder",